{"$schema":"https://json-schema.org/draft/2020-12/schema","$id":"voce.prompt-ir/v1alpha2","type":"object","required":["schemaVersion","id","caseId","caseRevision","contextHash","compilationSignature","constraintIRHash","referencePlanHash","pipelinePlanHash","outputContractHash","targetAdapter","targetCapabilityProfile","objective","positiveDescription","sections","parameters","referenceMappings","forbidden","output","constraintCoverage","excludedConstraints","sourceIds","constraintIds","decisionIds","assetIds","deterministicSignature"],"properties":{"schemaVersion":{"const":"voce.prompt-ir/v1alpha2"},"id":{"type":"string"},"caseId":{"type":"string"},"caseRevision":{"type":"integer"},"contextHash":{"type":"string","pattern":"^sha256:[0-9a-f]{64}$"},"compilationSignature":{"type":"string","pattern":"^sha256:[0-9a-f]{64}$"},"constraintIRHash":{"type":"string","pattern":"^sha256:[0-9a-f]{64}$"},"referencePlanHash":{"type":"string","pattern":"^sha256:[0-9a-f]{64}$"},"pipelinePlanHash":{"type":"string","pattern":"^sha256:[0-9a-f]{64}$"},"outputContractHash":{"type":"string","pattern":"^sha256:[0-9a-f]{64}$"},"targetAdapter":{"type":"object","required":["id","version","digest"],"properties":{"id":{"type":"string"},"version":{"type":"string"},"digest":{"type":"string","pattern":"^sha256:[0-9a-f]{64}$"}},"additionalProperties":false},"targetCapabilityProfile":{"type":"object","required":["id","version","digest"],"properties":{"id":{"type":"string"},"version":{"type":"string"},"digest":{"type":"string","pattern":"^sha256:[0-9a-f]{64}$"}},"additionalProperties":false},"objective":{"type":"string"},"positiveDescription":{"type":"string"},"sections":{"type":"array","items":{"$ref":"voce.prompt-section/v1alpha1"}},"parameters":{"type":"array","items":{"$ref":"voce.prompt-parameter/v1alpha1"}},"referenceMappings":{"type":"array","items":{"$ref":"voce.prompt-reference-mapping/v1alpha1"}},"forbidden":{"type":"array","items":{"type":"object"}},"output":{"type":"object"},"constraintCoverage":{"type":"array","items":{"$ref":"voce.prompt-constraint-coverage/v1alpha1"}},"excludedConstraints":{"type":"array","items":{"$ref":"voce.prompt-constraint-exclusion/v1alpha1"}},"sourceIds":{"type":"array","items":{"type":"string"}},"constraintIds":{"type":"array","items":{"type":"string"}},"decisionIds":{"type":"array","items":{"type":"string"}},"assetIds":{"type":"array","items":{"type":"string"}},"deterministicSignature":{"type":"string","pattern":"^sha256:[0-9a-f]{64}$"}},"additionalProperties":false}
